{"schema_version":"2.1","tenant_id":"00000000-0000-0000-0000-000000000001","site_id":"00000000-0000-0000-0000-000000000002","device_id":"00000000-0000-0000-0000-000000000003","catalog_version":"2026.08.25.1","sequence":42,"observed_at":"2026-08-25T12:00:10Z","samples":[{"point_key":"deye.hybrid_1p.battery.battery","raw":537,"decoded":53.7,"quality":"good"}],"dropped_samples":0,"gap":false}
